{
  "schema_version": 1,
  "experiment_id": "large-file-demotion",
  "title": "Large File Default-Lane Demotion",
  "workstream": "structural_pressure",
  "status": "in_progress",
  "cycle_id": "2026-04-cycle-1",
  "program_id": "agent-loop-core",
  "phase_id": "phase_6_structural_pressure_demotion",
  "owner_doc": "../../experiment-program.md",
  "decision_question": "Should large_file remain eligible for the default lane at all, and if so under what exact restrictions?",
  "hypothesis": "Large-file pressure is structurally true but often low-value as an intervention signal, and should demote unless the patch directly worsened it and the repair surface is concrete.",
  "primary_metrics": [
    "top_action_help_rate",
    "top_action_follow_rate",
    "task_success_rate",
    "patch_expansion_rate"
  ],
  "secondary_metrics": [
    "demotion_candidate_count",
    "ranking_miss_count",
    "reviewed_precision",
    "intervention_net_value_score"
  ],
  "variants": [
    {
      "variant_id": "current_policy",
      "name": "Current policy",
      "status": "active",
      "description": "Current structural-pressure behavior including large_file.",
      "policy_delta": null
    },
    {
      "variant_id": "demoted_to_supporting",
      "name": "Demote to supporting",
      "status": "screening",
      "description": "Keep large_file visible only as supporting evidence under a stronger causal lead.",
      "policy_delta": "Never allow large_file to occupy a primary action slot."
    },
    {
      "variant_id": "patch_local_only",
      "name": "Patch-local only",
      "status": "screening",
      "description": "Only surface large_file when the patch itself worsened reviewability in the touched file and the fix site is concrete.",
      "policy_delta": "Require direct patch-local causality and fixability."
    }
  ],
  "repo_runs": [
    {
      "run_id": "sentrux-current",
      "repo_id": "sentrux",
      "variant_id": "current_policy",
      "manifest": "../repos/sentrux.json",
      "output_dir": ".sentrux/evals/experiments/large-file-demotion/current/sentrux",
      "artifact_expectations": ["repo_calibration_loop", "evidence_review", "session_corpus"]
    },
    {
      "run_id": "parallel-code-current",
      "repo_id": "parallel-code",
      "variant_id": "current_policy",
      "manifest": "../repos/parallel-code.json",
      "output_dir": ".sentrux/evals/experiments/large-file-demotion/current/parallel-code",
      "artifact_expectations": ["repo_calibration_loop", "evidence_review", "session_corpus"]
    }
  ],
  "exit_bar": [
    "Confirm whether large_file improves help rate on any repo once patch-expansion cost is included.",
    "Demote large_file from the default lane if it remains a reviewed-true but low-follow or low-help signal.",
    "Capture an explicit keep or demote decision with the exact admissibility rule."
  ],
  "decision": null
}
